{
  "schemaVersion": "1.0.0",
  "executionVersion": "0.1.0",
  "executionId": "WER-2026-07-02T05-31-56-949Z-TRANS-RunBenchmark-Refresh",
  "transitionId": "TRANS-RunBenchmark-Refresh",
  "transitionType": "RunBenchmark",
  "approvalClass": "AutoEligible",
  "startedAt": "2026-07-02T05:31:56.933Z",
  "finishedAt": "2026-07-02T05:31:56.949Z",
  "status": "DryRun",
  "inputs": {
    "mode": "dryRun",
    "allowMutations": false,
    "sourceReportId": "WFR-GRAPH-AInvil-Example-2026-07-02",
    "sourcePlanId": "WTP-GRAPH-AInvil-Example-2026-07-02",
    "sourceApprovalId": "WTA-WTP-GRAPH-AInvil-Example-2026-07-02-2026-07-02",
    "transitionId": "TRANS-RunBenchmark-Refresh",
    "targetArtifactId": "benchmarks/reports/latest-benchmark-report.json"
  },
  "outputs": {
    "createdFiles": [],
    "updatedFiles": [],
    "graphPatchPlan": null,
    "summary": "RunBenchmark would regenerate benchmark Markdown and JSON reports."
  },
  "evidenceRefs": [],
  "errors": [],
  "blockedReason": null,
  "nextAction": {
    "actionId": "WFA-Validate-Gap",
    "title": "Resolve the highest validation gap.",
    "reason": "AC-CoreLoop-001 is below the required validation confidence.",
    "suggestedOwner": "Input Agent",
    "priority": "High",
    "referencesNodeIds": [
      "AC-CoreLoop-001"
    ],
    "referencesReviewIds": [],
    "referencesBenchmarkIds": [],
    "referencesKpiItems": [],
    "evidenceStatus": "Evidence exists for the referenced graph node, but required validation evidence or confidence is missing."
  }
}
